Tool Name,Website URL,Domain,Domain Extension,Domain Length,Description,Description Word Count,Tags,Category,Subcategory,Is Open Source,GitHub Stars,GitHub Forks,Primary Language,GitHub Open Issues
NVIDIA Omniverse AI Animal Explorer Extension,https://docs.omniverse.nvidia.com/extensions/latest/ext_animal-explorer.html#installation,docs.omniverse.nvidia.com,com,25,AI Animal Explorer is an Omniverse extension that enables creators to quickly prototype unique 3D animal meshes,17,search,NVIDIA Platform Extensions,General,False,0,0,None,0
Altern,https://altern.ai,altern.ai,ai,9,Find Best AI Tools,4,search,Related Awesome Lists,General,False,0,0,None,0
Best of AI,https://github.com/best-of-ai/best-of-ai,github.com,com,10,Like Michelin Guide for AI,5,general,Related Awesome Lists,General,True,625,91,HTML,25
Awesome AI Models,https://github.com/dariubs/awesome-ai-models,github.com,com,10,A curated list of top AI models and LLMs,9,general,Related Awesome Lists,General,True,142,18,nan,1
Awesome AI Coding Tools,https://github.com/ai-for-developers/awesome-ai-coding-tools,github.com,com,10,Curated list of AI-powered developer tools,6,code,Related Awesome Lists,General,True,1798,425,nan,155
Awesome Vibe Coding,http://github.com/dariubs/awesome-vibe-coding,github.com,com,10,A hand-picked collection of tools and resources for Vibe Coding,10,code,Related Awesome Lists,General,True,748,157,nan,37
Awesome AI Books,https://github.com/mahseema/aibooks,github.com,com,10,Curated List of Top AI and ML Books,8,general,Related Awesome Lists,General,True,80,7,nan,0
AI for Productivity,https://productivity.directory/category/ai,productivity.directory,directory,22,Curated List of AI Apps for productivity,7,productivity,Related Awesome Lists,General,False,0,0,None,0
Workflow Automation Softwares,https://productivity.directory/category/workflow-automation,productivity.directory,directory,22,Curated List of Workflow Automation Apps And Tools,8,agent,Related Awesome Lists,General,False,0,0,None,0
Awesome Workflow Automation,https://github.com/dariubs/awesome-workflow-automation,github.com,com,10,Curated List of Workflow Automation Apps And Tools,8,agent,Related Awesome Lists,General,True,1064,172,nan,40
Top AI Directories,https://github.com/best-of-ai/ai-directories,github.com,com,10,An awesome list of best top AI directories to submit your ai tools,13,general,Related Awesome Lists,General,True,828,422,nan,83
